{
    "id": "PHANTOM",
    "label": "DJI Phantom 4",
    "manufacturer": "DJI",
    "category": "medium",

    "physical": {
        "mass": 1.380,
        "armLength": 0.25,
        "boundingRadius": 0.40,
        "propCount": 4
    },

    "performance": {
        "maxSpeed": 4.0,
        "maxClimb": 2.5,
        "cruiseAlt": 6.0,
        "maxAlt": 20.0,
        "agility": 1.0,
        "explorationRadius": 50,
        "endurance_min": 28
    },

    "pid": {
        "pos":  { "kp": 1.4, "ki": 0.02, "kd": 0.5 },
        "alt":  { "kp": 2.2, "ki": 0.04, "kd": 0.6 },
        "yaw":  { "kp": 1.0, "ki": 0.0,  "kd": 0.12 }
    },

    "visual": {
        "scale": 20,
        "color": "0xFF8800",
        "model": "phantom"
    }
}
